{
  "composite_recipe_name": "org.dsarp.architecture.RefactorBenchmarkArchitecture",
  "global_postconditions": [
    "All moved source paths match their new package declarations.",
    "All imports, fully qualified references, declarations, and type attribution use the new packages.",
    "No unrelated responsibility under the original component moved.",
    "The benchmark build and tests pass and the semantic analyzer reports no unresolved symbols.",
    "The resulting component graph has no newly introduced cycle."
  ],
  "global_preconditions": [
    "The working tree matches source_commit and contains no unreviewed overlapping edits.",
    "The benchmark clean build and all tests pass.",
    "All seven source packages contain exactly the analyzed symbol sets.",
    "A successful OpenRewrite dry run is reviewed before any rewrite:run invocation.",
    "No operation crosses a Maven module boundary in this plan."
  ],
  "operations": [
    {
      "affected_packages": [
        "com.dsarp.shop.megacomponent.reporting",
        "com.dsarp.shop.reporting"
      ],
      "affected_symbols": [
        "com.dsarp.shop.megacomponent.reporting.CustomerCohortReporter",
        "com.dsarp.shop.megacomponent.reporting.DeliveryPerformanceReporter",
        "com.dsarp.shop.megacomponent.reporting.InventoryTurnoverReporter",
        "com.dsarp.shop.megacomponent.reporting.OrderVolumeAnalyzer",
        "com.dsarp.shop.megacomponent.reporting.PromotionPerformanceReporter",
        "com.dsarp.shop.megacomponent.reporting.RevenueSummaryCalculator",
        "com.dsarp.shop.megacomponent.reporting.SalesReportGenerator"
      ],
      "automation_class": "DECLARATIVE_BUILT_IN",
      "execution_order": 30,
      "expected_dependency_edges_added": [
        "com.dsarp.shop.reporting.CustomerCohortReporter -> com.dsarp.shop.model.CapabilityDecision",
        "com.dsarp.shop.reporting.CustomerCohortReporter -> com.dsarp.shop.model.OrderContext",
        "com.dsarp.shop.reporting.CustomerCohortReporter -> com.dsarp.shop.shared.AbstractBusinessCapability",
        "com.dsarp.shop.reporting.DeliveryPerformanceReporter -> com.dsarp.shop.model.CapabilityDecision",
        "com.dsarp.shop.reporting.DeliveryPerformanceReporter -> com.dsarp.shop.model.OrderContext",
        "com.dsarp.shop.reporting.DeliveryPerformanceReporter -> com.dsarp.shop.shared.AbstractBusinessCapability",
        "com.dsarp.shop.reporting.InventoryTurnoverReporter -> com.dsarp.shop.model.CapabilityDecision",
        "com.dsarp.shop.reporting.InventoryTurnoverReporter -> com.dsarp.shop.model.OrderContext",
        "com.dsarp.shop.reporting.InventoryTurnoverReporter -> com.dsarp.shop.shared.AbstractBusinessCapability",
        "com.dsarp.shop.reporting.OrderVolumeAnalyzer -> com.dsarp.shop.model.CapabilityDecision",
        "com.dsarp.shop.reporting.OrderVolumeAnalyzer -> com.dsarp.shop.model.OrderContext",
        "com.dsarp.shop.reporting.OrderVolumeAnalyzer -> com.dsarp.shop.shared.AbstractBusinessCapability",
        "com.dsarp.shop.reporting.PromotionPerformanceReporter -> com.dsarp.shop.model.CapabilityDecision",
        "com.dsarp.shop.reporting.PromotionPerformanceReporter -> com.dsarp.shop.model.OrderContext",
        "com.dsarp.shop.reporting.PromotionPerformanceReporter -> com.dsarp.shop.shared.AbstractBusinessCapability",
        "com.dsarp.shop.reporting.RevenueSummaryCalculator -> com.dsarp.shop.model.CapabilityDecision",
        "com.dsarp.shop.reporting.RevenueSummaryCalculator -> com.dsarp.shop.model.OrderContext",
        "com.dsarp.shop.reporting.RevenueSummaryCalculator -> com.dsarp.shop.shared.AbstractBusinessCapability",
        "com.dsarp.shop.reporting.SalesReportGenerator -> com.dsarp.shop.model.CapabilityDecision",
        "com.dsarp.shop.reporting.SalesReportGenerator -> com.dsarp.shop.model.OrderContext",
        "com.dsarp.shop.reporting.SalesReportGenerator -> com.dsarp.shop.shared.AbstractBusinessCapability"
      ],
      "expected_dependency_edges_removed": [
        "com.dsarp.shop.megacomponent.reporting.CustomerCohortReporter -> com.dsarp.shop.model.CapabilityDecision",
        "com.dsarp.shop.megacomponent.reporting.CustomerCohortReporter -> com.dsarp.shop.model.OrderContext",
        "com.dsarp.shop.megacomponent.reporting.CustomerCohortReporter -> com.dsarp.shop.shared.AbstractBusinessCapability",
        "com.dsarp.shop.megacomponent.reporting.DeliveryPerformanceReporter -> com.dsarp.shop.model.CapabilityDecision",
        "com.dsarp.shop.megacomponent.reporting.DeliveryPerformanceReporter -> com.dsarp.shop.model.OrderContext",
        "com.dsarp.shop.megacomponent.reporting.DeliveryPerformanceReporter -> com.dsarp.shop.shared.AbstractBusinessCapability",
        "com.dsarp.shop.megacomponent.reporting.InventoryTurnoverReporter -> com.dsarp.shop.model.CapabilityDecision",
        "com.dsarp.shop.megacomponent.reporting.InventoryTurnoverReporter -> com.dsarp.shop.model.OrderContext",
        "com.dsarp.shop.megacomponent.reporting.InventoryTurnoverReporter -> com.dsarp.shop.shared.AbstractBusinessCapability",
        "com.dsarp.shop.megacomponent.reporting.OrderVolumeAnalyzer -> com.dsarp.shop.model.CapabilityDecision",
        "com.dsarp.shop.megacomponent.reporting.OrderVolumeAnalyzer -> com.dsarp.shop.model.OrderContext",
        "com.dsarp.shop.megacomponent.reporting.OrderVolumeAnalyzer -> com.dsarp.shop.shared.AbstractBusinessCapability",
        "com.dsarp.shop.megacomponent.reporting.PromotionPerformanceReporter -> com.dsarp.shop.model.CapabilityDecision",
        "com.dsarp.shop.megacomponent.reporting.PromotionPerformanceReporter -> com.dsarp.shop.model.OrderContext",
        "com.dsarp.shop.megacomponent.reporting.PromotionPerformanceReporter -> com.dsarp.shop.shared.AbstractBusinessCapability",
        "com.dsarp.shop.megacomponent.reporting.RevenueSummaryCalculator -> com.dsarp.shop.model.CapabilityDecision",
        "com.dsarp.shop.megacomponent.reporting.RevenueSummaryCalculator -> com.dsarp.shop.model.OrderContext",
        "com.dsarp.shop.megacomponent.reporting.RevenueSummaryCalculator -> com.dsarp.shop.shared.AbstractBusinessCapability",
        "com.dsarp.shop.megacomponent.reporting.SalesReportGenerator -> com.dsarp.shop.model.CapabilityDecision",
        "com.dsarp.shop.megacomponent.reporting.SalesReportGenerator -> com.dsarp.shop.model.OrderContext",
        "com.dsarp.shop.megacomponent.reporting.SalesReportGenerator -> com.dsarp.shop.shared.AbstractBusinessCapability"
      ],
      "expected_files": [
        "shop-business/src/main/java/com/dsarp/shop/megacomponent/reporting/CustomerCohortReporter.java",
        "shop-business/src/main/java/com/dsarp/shop/megacomponent/reporting/DeliveryPerformanceReporter.java",
        "shop-business/src/main/java/com/dsarp/shop/megacomponent/reporting/InventoryTurnoverReporter.java",
        "shop-business/src/main/java/com/dsarp/shop/megacomponent/reporting/OrderVolumeAnalyzer.java",
        "shop-business/src/main/java/com/dsarp/shop/megacomponent/reporting/PromotionPerformanceReporter.java",
        "shop-business/src/main/java/com/dsarp/shop/megacomponent/reporting/RevenueSummaryCalculator.java",
        "shop-business/src/main/java/com/dsarp/shop/megacomponent/reporting/SalesReportGenerator.java"
      ],
      "operation_id": "OP::e5f4488bb0575987",
      "options": {
        "newPackageName": "com.dsarp.shop.reporting",
        "oldPackageName": "com.dsarp.shop.megacomponent.reporting",
        "recursive": false
      },
      "postconditions": [
        "All 7 declarations and source paths reside under com.dsarp.shop.reporting.",
        "All resolved callers reference the new fully qualified type names.",
        "No production declaration remains directly in com.dsarp.shop.megacomponent.reporting."
      ],
      "preconditions": [
        "Exactly 7 analyzed production types are declared directly in com.dsarp.shop.megacomponent.reporting.",
        "Every affected type remains in its current Maven module.",
        "The simulated package move introduces no component cycle.",
        "No unrelated subpackage is selected because recursive is false."
      ],
      "recipe_name": "org.openrewrite.java.ChangePackage",
      "recommendation_id": "REC::c0750f828761f1b8",
      "risk": "MEDIUM",
      "rollback_description": "Revert this operation's dry-run diff or apply the inverse ChangePackage mapping before any subsequent operation.",
      "validation_commands": [
        "benchmark/mvnw -f benchmark/pom.xml clean verify",
        "rg -n '^package com\\.dsarp\\.shop\\.reporting;' benchmark/shop-business/src/main/java"
      ],
      "verified_recipe_source": "https://docs.openrewrite.org/recipes/java/changepackage"
    },
    {
      "affected_packages": [
        "com.dsarp.shop.megacomponent.promotion",
        "com.dsarp.shop.promotion"
      ],
      "affected_symbols": [
        "com.dsarp.shop.megacomponent.promotion.CartThresholdEvaluator",
        "com.dsarp.shop.megacomponent.promotion.CouponEligibilityChecker",
        "com.dsarp.shop.megacomponent.promotion.LoyaltyDiscountCalculator",
        "com.dsarp.shop.megacomponent.promotion.PromotionEvaluator",
        "com.dsarp.shop.megacomponent.promotion.PromotionStackingResolver",
        "com.dsarp.shop.megacomponent.promotion.PromotionUsageRecorder",
        "com.dsarp.shop.megacomponent.promotion.SeasonalOfferSelector"
      ],
      "automation_class": "DECLARATIVE_BUILT_IN",
      "execution_order": 31,
      "expected_dependency_edges_added": [
        "com.dsarp.shop.application.OrderWorkflow -> com.dsarp.shop.promotion.PromotionEvaluator",
        "com.dsarp.shop.promotion.CartThresholdEvaluator -> com.dsarp.shop.model.CapabilityDecision",
        "com.dsarp.shop.promotion.CartThresholdEvaluator -> com.dsarp.shop.model.OrderContext",
        "com.dsarp.shop.promotion.CartThresholdEvaluator -> com.dsarp.shop.shared.AbstractBusinessCapability",